<?xml version="1.0" encoding="utf-8"?>
<!DOCTYPE fileOfQuestions SYSTEM "../../fileOfQuestions.dtd">
<fileOfQuestions fileName="CreatingClassesTest_javatutorial_items.xml" name="CreatingClassesTest_javatutorial_items" course="javatutorial" path="javatutorial/itemsFiles/CreatingClassesTest_javatutorial_items.xml" numberOfAnswersForFile="2"><concept value="javatutorial.CreatingClassesTest" /><questions><question codeQuestion="1"><enunciate>How many class variables does the IdentifyMyParts class contain? What are their names?</enunciate><image>javatutorial/itemsFiles/images/CreatingClassesTest_javatutorial_items/CreatingClassesTest_javatutorial_items_1.gif</image><answers numberOfCorrect="1" numberOfAnswers="2"><answer codeAnswer="1"><textAnswer>1, x</textAnswer><correct>true</correct><explanation>Write here the explanation.</explanation></answer><answer codeAnswer="2"><textAnswer>7, y</textAnswer><correct>false</correct><explanation>Write here the explanation.</explanation></answer></answers><irtParameters><difficulty>0.0</difficulty><discrimination>1.0</discrimination><guessing>0.5</guessing></irtParameters><statisticParameters><exhibitionRate>0.0</exhibitionRate><answerTime>0</answerTime><successRate>0.0</successRate><numberOfUses>-1</numberOfUses><numberOfSuccesses>-1</numberOfSuccesses></statisticParameters><testFiles><adaptiveTest><adaptiveTestFilePath>javatutorial/test/CreatingClassesTest_javatutorial_A_activity.xml</adaptiveTestFilePath></adaptiveTest></testFiles></question><question codeQuestion="2"><enunciate>How many instance variables does the IdentifyMyParts class contain? What are their names?</enunciate><image>javatutorial/itemsFiles/images/CreatingClassesTest_javatutorial_items/CreatingClassesTest_javatutorial_items_2.gif</image><answers numberOfCorrect="1" numberOfAnswers="2"><answer codeAnswer="1"><textAnswer>1,x</textAnswer><correct>false</correct><explanation>Write here the explanation.</explanation></answer><answer codeAnswer="2"><textAnswer>1, y</textAnswer><correct>true</correct><explanation>Write here the explanation.</explanation></answer></answers><irtParameters><difficulty>0.0</difficulty><discrimination>1.0</discrimination><guessing>0.5</guessing></irtParameters><statisticParameters><exhibitionRate>0.0</exhibitionRate><answerTime>0</answerTime><successRate>0.0</successRate><numberOfUses>-1</numberOfUses><numberOfSuccesses>-1</numberOfSuccesses></statisticParameters><testFiles><adaptiveTest><adaptiveTestFilePath>javatutorial/test/CreatingClassesTest_javatutorial_A_activity.xml</adaptiveTestFilePath></adaptiveTest></testFiles></question></questions></fileOfQuestions>
