<?xml version="1.0" encoding="utf-8"?>
<!DOCTYPE fileOfQuestions SYSTEM "../../fileOfQuestions.dtd">
<fileOfQuestions fileName="GettingStartedTest_javatutorial_items.xml" name="GettingStartedTest_javatutorial_items" course="javatutorial" path="javatutorial/itemsFiles/GettingStartedTest_javatutorial_items.xml" numberOfAnswersForFile="4"><concept value="javatutorial.GettingStartedTest" /><questions><question codeQuestion="1"><enunciate>When you compile a program written in the Java programming language, the compiler converts the human-readable source file into platform-independent code that a Java Virtual Machine can understand. What is this platform-independent code called?</enunciate><image /><answers numberOfCorrect="1" numberOfAnswers="4"><answer codeAnswer="1"><textAnswer>Excutable code</textAnswer><correct>false</correct><explanation>No explanation</explanation></answer><answer codeAnswer="2"><textAnswer>Byte code</textAnswer><correct>true</correct><explanation>No explanation</explanation></answer><answer codeAnswer="3"><textAnswer>Interpret code</textAnswer><correct>false</correct><explanation>No explanation</explanation></answer><answer codeAnswer="4"><textAnswer>Shell code</textAnswer><correct>false</correct><explanation>No explanation</explanation></answer></answers><irtParameters><difficulty>0.0</difficulty><discrimination>1.0</discrimination><guessing>0.25</guessing></irtParameters><statisticParameters><exhibitionRate>0.0</exhibitionRate><answerTime>0</answerTime><successRate>0.0</successRate><numberOfUses>-1</numberOfUses><numberOfSuccesses>-1</numberOfSuccesses></statisticParameters><testFiles><classicTest><classicTestFilePath>javatutorial/test/GettingStartedTest_javatutorial_C_activity.xml</classicTestFilePath></classicTest><adaptiveTest><adaptiveTestFilePath>javatutorial/test/GettingStartedTest_javatutorial_A_activity.xml</adaptiveTestFilePath></adaptiveTest></testFiles></question><question codeQuestion="2"><enunciate>Which of the following is not a valid comment:</enunciate><image /><answers numberOfCorrect="1" numberOfAnswers="4"><answer codeAnswer="1"><textAnswer>/** comment */</textAnswer><correct>false</correct><explanation>No explanation</explanation></answer><answer codeAnswer="2"><textAnswer>/* comment */</textAnswer><correct>false</correct><explanation>No explanation</explanation></answer><answer codeAnswer="3"><textAnswer>/* comment</textAnswer><correct>true</correct><explanation>No explanation</explanation></answer><answer codeAnswer="4"><textAnswer>// comment</textAnswer><correct>false</correct><explanation>No explanation</explanation></answer></answers><irtParameters><difficulty>0.0</difficulty><discrimination>1.0</discrimination><guessing>0.25</guessing></irtParameters><statisticParameters><exhibitionRate>0.0</exhibitionRate><answerTime>0</answerTime><successRate>0.0</successRate><numberOfUses>-1</numberOfUses><numberOfSuccesses>-1</numberOfSuccesses></statisticParameters><testFiles><classicTest><classicTestFilePath>javatutorial/test/GettingStartedTest_javatutorial_C_activity.xml</classicTestFilePath></classicTest><adaptiveTest><adaptiveTestFilePath>javatutorial/test/GettingStartedTest_javatutorial_A_activity.xml</adaptiveTestFilePath></adaptiveTest></testFiles></question><question codeQuestion="3"><enunciate>What is the first thing you should check if the interpreter returns the error: Exception in thread "main" java.lang.NoClassDefFoundError: HelloWorldApp.java</enunciate><image /><answers numberOfCorrect="1" numberOfAnswers="4"><answer codeAnswer="1"><textAnswer>Check runtime errors in HelloWorldApp.java code</textAnswer><correct>false</correct><explanation>No explanation</explanation></answer><answer codeAnswer="2"><textAnswer>Check where Java Runtime Environment is installed</textAnswer><correct>false</correct><explanation>No explanation</explanation></answer><answer codeAnswer="3"><textAnswer>Check your classpath. The interpreter cannot find your class</textAnswer><correct>true</correct><explanation>No explanation</explanation></answer><answer codeAnswer="4"><textAnswer>Check Java interpreter</textAnswer><correct>false</correct><explanation>No explanation</explanation></answer></answers><irtParameters><difficulty>2.0</difficulty><discrimination>3.0</discrimination><guessing>0.25</guessing></irtParameters><statisticParameters><exhibitionRate>0.0</exhibitionRate><answerTime>0</answerTime><successRate>0.0</successRate><numberOfUses>-1</numberOfUses><numberOfSuccesses>-1</numberOfSuccesses></statisticParameters><testFiles><classicTest><classicTestFilePath>javatutorial/test/GettingStartedTest_javatutorial_C_activity.xml</classicTestFilePath></classicTest><adaptiveTest><adaptiveTestFilePath>javatutorial/test/GettingStartedTest_javatutorial_A_activity.xml</adaptiveTestFilePath></adaptiveTest></testFiles></question></questions></fileOfQuestions>
