<?xml version="1.0" encoding="utf-8"?>
<!DOCTYPE fileOfQuestions SYSTEM "../../fileOfQuestions.dtd">
<fileOfQuestions fileName="NumbersTest_javatutorial_items.xml" name="NumbersTest_javatutorial_items" course="javatutorial" path="javatutorial/itemsFiles/NumbersTest_javatutorial_items.xml" numberOfAnswersForFile="2"><concept value="javatutorial.NumbersTest" /><questions><question codeQuestion="1"><enunciate>What Integer method can you use to convert an int into a string that expresses the number in hexadecimal? For example, what method converts the integer 65 into the string "41"?</enunciate><image /><answers numberOfCorrect="1" numberOfAnswers="3"><answer codeAnswer="1"><textAnswer>toHexText</textAnswer><correct>false</correct><explanation>Write here the explanation.</explanation></answer><answer codeAnswer="2"><textAnswer>toHexString</textAnswer><correct>true</correct><explanation>Write here the explanation.</explanation></answer><answer codeAnswer="3"><textAnswer>hexString</textAnswer><correct>false</correct><explanation>Write here the explanation.</explanation></answer></answers><irtParameters><difficulty>0.0</difficulty><discrimination>1.0</discrimination><guessing>0.3333333333333333</guessing></irtParameters><statisticParameters><exhibitionRate>0.0</exhibitionRate><answerTime>0</answerTime><successRate>0.0</successRate><numberOfUses>0</numberOfUses><numberOfSuccesses>0</numberOfSuccesses></statisticParameters><testFiles><adaptiveTest><adaptiveTestFilePath>javatutorial/test/NumbersTest_javatutorial_A_activity.xml</adaptiveTestFilePath></adaptiveTest></testFiles></question><question codeQuestion="2"><enunciate>What Double method can you use to detect whether a floating-point number has the special value Not a Number?</enunciate><image /><answers numberOfCorrect="1" numberOfAnswers="3"><answer codeAnswer="1"><textAnswer>isNull</textAnswer><correct>false</correct><explanation>Write here the explanation.</explanation></answer><answer codeAnswer="2"><textAnswer>isNotNumber</textAnswer><correct>false</correct><explanation>Write here the explanation.</explanation></answer><answer codeAnswer="3"><textAnswer>isNaN</textAnswer><correct>true</correct><explanation>No Explanation</explanation></answer></answers><irtParameters><difficulty>0.0</difficulty><discrimination>1.0</discrimination><guessing>0.3333333333333333</guessing></irtParameters><statisticParameters><exhibitionRate>0.0</exhibitionRate><answerTime>0</answerTime><successRate>0.0</successRate><numberOfUses>0</numberOfUses><numberOfSuccesses>0</numberOfSuccesses></statisticParameters><testFiles><adaptiveTest><adaptiveTestFilePath>javatutorial/test/NumbersTest_javatutorial_A_activity.xml</adaptiveTestFilePath></adaptiveTest></testFiles></question><question codeQuestion="3"><enunciate>What is the value of the following expression, and why? new Integer(1).equals(new Long(1))</enunciate><image /><answers numberOfCorrect="1" numberOfAnswers="3"><answer codeAnswer="1"><textAnswer>False. The two objects (the Integer and the Long) have different types.</textAnswer><correct>true</correct><explanation>Write here the explanation.</explanation></answer><answer codeAnswer="2"><textAnswer>True. The two objects (the Integer and the Long) are number types.</textAnswer><correct>false</correct><explanation>Write here the explanation.</explanation></answer><answer codeAnswer="3"><textAnswer>False. There is no method "equals"</textAnswer><correct>false</correct><explanation>Write here the explanation.</explanation></answer></answers><irtParameters><difficulty>0.0</difficulty><discrimination>1.0</discrimination><guessing>0.3333333333333333</guessing></irtParameters><statisticParameters><exhibitionRate>0.0</exhibitionRate><answerTime>0</answerTime><successRate>0.0</successRate><numberOfUses>0</numberOfUses><numberOfSuccesses>0</numberOfSuccesses></statisticParameters><testFiles><adaptiveTest><adaptiveTestFilePath>javatutorial/test/NumbersTest_javatutorial_A_activity.xml</adaptiveTestFilePath></adaptiveTest></testFiles></question></questions></fileOfQuestions>
