<?xml version="1.0" encoding="utf-8"?>
<!DOCTYPE fileOfQuestions SYSTEM "../../fileOfQuestions.dtd">
<fileOfQuestions fileName="EnumeratedTypesTest_javatutorial_items.xml" name="EnumeratedTypesTest_javatutorial_items" course="javatutorial" path="javatutorial/itemsFiles/EnumeratedTypesTest_javatutorial_items.xml" numberOfAnswersForFile="2"><concept value="javatutorial.EnumeratedTypesTest" /><questions><question codeQuestion="1"><enunciate>What are right assertions about enumerated types?</enunciate><image /><answers numberOfCorrect="3" numberOfAnswers="4"><answer codeAnswer="1"><textAnswer>They are typesafe.</textAnswer><correct>true</correct><explanation>Write here the explanation.</explanation></answer><answer codeAnswer="2"><textAnswer>They exist in their own namespace</textAnswer><correct>true</correct><explanation>Write here the explanation.</explanation></answer><answer codeAnswer="3"><textAnswer>They are Comparable and Serializable</textAnswer><correct>true</correct><explanation>Write here the explanation.</explanation></answer><answer codeAnswer="4"><textAnswer>it's possible for one enum type to extend another enum type</textAnswer><correct>false</correct><explanation>Write here the explanation.</explanation></answer></answers><irtParameters><difficulty>0.0</difficulty><discrimination>1.0</discrimination><guessing>0.25</guessing></irtParameters><statisticParameters><exhibitionRate>0.0</exhibitionRate><answerTime>0</answerTime><successRate>0.0</successRate><numberOfUses>0</numberOfUses><numberOfSuccesses>0</numberOfSuccesses></statisticParameters><testFiles><adaptiveTest><adaptiveTestFilePath>javatutorial/test/EnumeratedTypesTest_javatutorial_A_activity.xml</adaptiveTestFilePath></adaptiveTest></testFiles></question></questions></fileOfQuestions>
