<?xml version="1.0" encoding="utf-8"?>
<!DOCTYPE fileOfQuestions SYSTEM "../../fileOfQuestions.dtd">
<fileOfQuestions fileName="ExpressionsStatementsBlocksTest_javatutorial_items.xml" name="ExpressionsStatementsBlocksTest_javatutorial_items" course="javatutorial" path="javatutorial/itemsFiles/ExpressionsStatementsBlocksTest_javatutorial_items.xml" numberOfAnswersForFile="2"><concept value="javatutorial.ExpressionsStatementsBlocksTest" /><questions><question codeQuestion="1"><enunciate>What are the data types of the following expressions, assuming that i's type is int?</enunciate><image>javatutorial/itemsFiles/images/ExpressionsStatementsBlocksTest_javatutorial_items/ExpressionsStatementsBlocksTest_javatutorial_items_1.gif</image><answers numberOfCorrect="1" numberOfAnswers="3"><answer codeAnswer="1"><textAnswer>Line 1: boolean. Line 2: int. Line3: int. Line 4: float. Line 5: boolean. Line 6: String</textAnswer><correct>true</correct><explanation>Write here the explanation.</explanation></answer><answer codeAnswer="2"><textAnswer>Line 1: boolean. Line 2: int. Line 3: int. Line 4: float. Line 5: int. Line 6: int</textAnswer><correct>false</correct><explanation>Write here the explanation.</explanation></answer><answer codeAnswer="3"><textAnswer>Line 1: int. Line 2: int. Line 3: int. Line 4: float. Line 5: boolean. Line 6: String</textAnswer><correct>false</correct><explanation>Write here the explanation.</explanation></answer></answers><irtParameters><difficulty>0.0</difficulty><discrimination>1.0</discrimination><guessing>0.3333333333333333</guessing></irtParameters><statisticParameters><exhibitionRate>0.0</exhibitionRate><answerTime>0</answerTime><successRate>0.0</successRate><numberOfUses>-1</numberOfUses><numberOfSuccesses>-1</numberOfSuccesses></statisticParameters><testFiles><adaptiveTest><adaptiveTestFilePath>javatutorial/test/ExpressionsStatementsBlocksTest_javatutorial_A_activity.xml</adaptiveTestFilePath></adaptiveTest></testFiles></question><question codeQuestion="2"><enunciate>Consider the following expression: "i--%5&gt;0". What is the result of the expression, assuming that the value of i is initially 10?</enunciate><image /><answers numberOfCorrect="1" numberOfAnswers="2"><answer codeAnswer="1"><textAnswer>false</textAnswer><correct>true</correct><explanation>Write here the explanation.</explanation></answer><answer codeAnswer="2"><textAnswer>true</textAnswer><correct>false</correct><explanation>Write here the explanation.</explanation></answer></answers><irtParameters><difficulty>0.0</difficulty><discrimination>1.0</discrimination><guessing>0.5</guessing></irtParameters><statisticParameters><exhibitionRate>0.0</exhibitionRate><answerTime>0</answerTime><successRate>0.0</successRate><numberOfUses>-1</numberOfUses><numberOfSuccesses>-1</numberOfSuccesses></statisticParameters><testFiles><adaptiveTest><adaptiveTestFilePath>javatutorial/test/ExpressionsStatementsBlocksTest_javatutorial_A_activity.xml</adaptiveTestFilePath></adaptiveTest></testFiles></question><question codeQuestion="3"><enunciate>Consider the following expression: "i--%5&gt;0". Modify the expression so that it has the same result but is easier for programmers to read.</enunciate><image /><answers numberOfCorrect="1" numberOfAnswers="2"><answer codeAnswer="1"><textAnswer>i-- (% 5 &gt; 0)</textAnswer><correct>false</correct><explanation>Write here the explanation.</explanation></answer><answer codeAnswer="2"><textAnswer>(i-- % 5) &gt; 0</textAnswer><correct>true</correct><explanation>Write here the explanation.</explanation></answer></answers><irtParameters><difficulty>0.0</difficulty><discrimination>1.0</discrimination><guessing>0.5</guessing></irtParameters><statisticParameters><exhibitionRate>0.0</exhibitionRate><answerTime>0</answerTime><successRate>0.0</successRate><numberOfUses>-1</numberOfUses><numberOfSuccesses>-1</numberOfSuccesses></statisticParameters><testFiles><adaptiveTest><adaptiveTestFilePath>javatutorial/test/ExpressionsStatementsBlocksTest_javatutorial_A_activity.xml</adaptiveTestFilePath></adaptiveTest></testFiles></question></questions></fileOfQuestions>
