<?xml version="1.0" encoding="utf-8"?>
<!DOCTYPE fileOfQuestions SYSTEM "../../fileOfQuestions.dtd">
<fileOfQuestions fileName="ManagingInheritanceTest_javatutorial_items.xml" name="ManagingInheritanceTest_javatutorial_items" course="javatutorial" path="javatutorial/itemsFiles/ManagingInheritanceTest_javatutorial_items.xml" numberOfAnswersForFile="2"><concept value="javatutorial.ManagingInheritanceTest" /><questions><question codeQuestion="1"><enunciate>Consider the following two classes: ClassA, ClassB. Which method overrides a method in the superclass?</enunciate><image>javatutorial/itemsFiles/images/ManagingInheritanceTest_javatutorial_items/ManagingInheritanceTest_javatutorial_items_1.gif</image><answers numberOfCorrect="1" numberOfAnswers="3"><answer codeAnswer="1"><textAnswer>methodTwo</textAnswer><correct>true</correct><explanation>Write here the explanation.</explanation></answer><answer codeAnswer="2"><textAnswer>methodOne</textAnswer><correct>false</correct><explanation>Write here the explanation.</explanation></answer><answer codeAnswer="3"><textAnswer>methodFour</textAnswer><correct>false</correct><explanation>Write here the explanation.</explanation></answer></answers><irtParameters><difficulty>0.0</difficulty><discrimination>1.0</discrimination><guessing>0.3333333333333333</guessing></irtParameters><statisticParameters><exhibitionRate>0.0</exhibitionRate><answerTime>0</answerTime><successRate>0.0</successRate><numberOfUses>-1</numberOfUses><numberOfSuccesses>-1</numberOfSuccesses></statisticParameters><testFiles><adaptiveTest><adaptiveTestFilePath>javatutorial/test/ManagingInheritanceTest_javatutorial_A_activity.xml</adaptiveTestFilePath></adaptiveTest></testFiles></question><question codeQuestion="2"><enunciate>Consider the following two classes: ClassA, ClassB. Which method hides a method in the superclass?</enunciate><image>javatutorial/itemsFiles/images/ManagingInheritanceTest_javatutorial_items/ManagingInheritanceTest_javatutorial_items_2.gif</image><answers numberOfCorrect="1" numberOfAnswers="2"><answer codeAnswer="1"><textAnswer>methodFour</textAnswer><correct>true</correct><explanation>Write here the explanation.</explanation></answer><answer codeAnswer="2"><textAnswer>methodTwo</textAnswer><correct>false</correct><explanation>Write here the explanation.</explanation></answer></answers><irtParameters><difficulty>0.0</difficulty><discrimination>1.0</discrimination><guessing>0.5</guessing></irtParameters><statisticParameters><exhibitionRate>0.0</exhibitionRate><answerTime>0</answerTime><successRate>0.0</successRate><numberOfUses>-1</numberOfUses><numberOfSuccesses>-1</numberOfSuccesses></statisticParameters><testFiles><adaptiveTest><adaptiveTestFilePath>javatutorial/test/ManagingInheritanceTest_javatutorial_A_activity.xml</adaptiveTestFilePath></adaptiveTest></testFiles></question></questions></fileOfQuestions>
