<?xml version="1.0" encoding="utf-8"?>
<!DOCTYPE fileOfQuestions SYSTEM "../../fileOfQuestions.dtd">
<fileOfQuestions fileName="ArraysTest_javatutorial_items.xml" name="ArraysTest_javatutorial_items" course="javatutorial" path="javatutorial/itemsFiles/ArraysTest_javatutorial_items.xml" numberOfAnswersForFile="2"><concept value="javatutorial.ArraysTest" /><questions><question codeQuestion="1"><enunciate>What is the index of Brighton in the following array? String[] skiResorts = { "Whistler Blackcomb", "Squaw Valley", "Brighton", "Snowmass", "Sun Valley", "Taos" };</enunciate><image /><answers numberOfCorrect="1" numberOfAnswers="2"><answer codeAnswer="1"><textAnswer>2</textAnswer><correct>true</correct><explanation>Write here the explanation.</explanation></answer><answer codeAnswer="2"><textAnswer>3</textAnswer><correct>false</correct><explanation>Write here the explanation.</explanation></answer></answers><irtParameters><difficulty>0.0</difficulty><discrimination>1.0</discrimination><guessing>0.5</guessing></irtParameters><statisticParameters><exhibitionRate>0.0</exhibitionRate><answerTime>0</answerTime><successRate>0.0</successRate><numberOfUses>-1</numberOfUses><numberOfSuccesses>-1</numberOfSuccesses></statisticParameters><testFiles><adaptiveTest><adaptiveTestFilePath>javatutorial/test/ArraysTest_javatutorial_A_activity.xml</adaptiveTestFilePath></adaptiveTest></testFiles></question><question codeQuestion="2"><enunciate>Given String[] skiResorts = { "Whistler Blackcomb", "Squaw Valley", "Brighton", "Snowmass", "Sun Valley", "Taos" }; What is the value of the expression skiResorts.length?</enunciate><image /><answers numberOfCorrect="1" numberOfAnswers="2"><answer codeAnswer="1"><textAnswer>6</textAnswer><correct>true</correct><explanation>Write here the explanation.</explanation></answer><answer codeAnswer="2"><textAnswer>8</textAnswer><correct>false</correct><explanation>Write here the explanation.</explanation></answer></answers><irtParameters><difficulty>0.0</difficulty><discrimination>1.0</discrimination><guessing>0.5</guessing></irtParameters><statisticParameters><exhibitionRate>0.0</exhibitionRate><answerTime>0</answerTime><successRate>0.0</successRate><numberOfUses>-1</numberOfUses><numberOfSuccesses>-1</numberOfSuccesses></statisticParameters><testFiles><adaptiveTest><adaptiveTestFilePath>javatutorial/test/ArraysTest_javatutorial_A_activity.xml</adaptiveTestFilePath></adaptiveTest></testFiles></question><question codeQuestion="3"><enunciate>Given: String[] skiResorts = { "Whistler Blackcomb", "Squaw Valley", "Brighton", "Snowmass", "Sun Valley", "Taos" }; What is the index of the last item in the array?</enunciate><image /><answers numberOfCorrect="1" numberOfAnswers="2"><answer codeAnswer="1"><textAnswer>5</textAnswer><correct>true</correct><explanation>Write here the explanation.</explanation></answer><answer codeAnswer="2"><textAnswer>4</textAnswer><correct>false</correct><explanation>Write here the explanation.</explanation></answer></answers><irtParameters><difficulty>0.0</difficulty><discrimination>1.0</discrimination><guessing>0.5</guessing></irtParameters><statisticParameters><exhibitionRate>0.0</exhibitionRate><answerTime>0</answerTime><successRate>0.0</successRate><numberOfUses>-1</numberOfUses><numberOfSuccesses>-1</numberOfSuccesses></statisticParameters><testFiles><adaptiveTest><adaptiveTestFilePath>javatutorial/test/ArraysTest_javatutorial_A_activity.xml</adaptiveTestFilePath></adaptiveTest></testFiles></question></questions></fileOfQuestions>
