<?xml version="1.0" encoding="utf-8"?>
<!DOCTYPE fileOfQuestions SYSTEM "../../fileOfQuestions.dtd">
<fileOfQuestions fileName="LifeCycleOfObjectTest_javatutorial_items.xml" name="LifeCycleOfObjectTest_javatutorial_items" course="javatutorial" path="javatutorial/itemsFiles/LifeCycleOfObjectTest_javatutorial_items.xml" numberOfAnswersForFile="2"><concept value="javatutorial.LifeCycleOfObjectTest" /><questions><question codeQuestion="1"><enunciate>Question 1: What's wrong with the following program?</enunciate><image>javatutorial/itemsFiles/images/LifeCycleOfObjectTest_javatutorial_items/LifeCycleOfObjectTest_javatutorial_items_1.gif</image><answers numberOfCorrect="1" numberOfAnswers="2"><answer codeAnswer="1"><textAnswer>The code never creates a Rectangle (in a .java source file) object</textAnswer><correct>true</correct><explanation>With this simple program, the compiler generates a warning. However, in a more realistic situation, myRect might be initialized to null in one place, say in a constructor, and used later</explanation></answer><answer codeAnswer="2"><textAnswer>The attributes "width" and "height" don't belong to class Rectangle</textAnswer><correct>false</correct><explanation>Write here the explanation.</explanation></answer></answers><irtParameters><difficulty>0.0</difficulty><discrimination>1.0</discrimination><guessing>0.5</guessing></irtParameters><statisticParameters><exhibitionRate>0.0</exhibitionRate><answerTime>0</answerTime><successRate>0.0</successRate><numberOfUses>-1</numberOfUses><numberOfSuccesses>-1</numberOfSuccesses></statisticParameters><testFiles><adaptiveTest><adaptiveTestFilePath>javatutorial/test/LifeCycleOfObjectTest_javatutorial_A_activity.xml</adaptiveTestFilePath></adaptiveTest></testFiles></question><question codeQuestion="2"><enunciate>The following code creates one Point (in a .java source file) object and one Rectangle (in a .java source file) object. How many references to those objects exist after the code executes?</enunciate><image>javatutorial/itemsFiles/images/LifeCycleOfObjectTest_javatutorial_items/LifeCycleOfObjectTest_javatutorial_items_2.gif</image><answers numberOfCorrect="1" numberOfAnswers="2"><answer codeAnswer="1"><textAnswer>Only one references to Rectangle object.</textAnswer><correct>false</correct><explanation>Write here the explanation.</explanation></answer><answer codeAnswer="2"><textAnswer>There is one reference to the Point object and one to the Rectangle object.</textAnswer><correct>true</correct><explanation>Write here the explanation.</explanation></answer></answers><irtParameters><difficulty>0.0</difficulty><discrimination>1.0</discrimination><guessing>0.5</guessing></irtParameters><statisticParameters><exhibitionRate>0.0</exhibitionRate><answerTime>0</answerTime><successRate>0.0</successRate><numberOfUses>-1</numberOfUses><numberOfSuccesses>-1</numberOfSuccesses></statisticParameters><testFiles><adaptiveTest><adaptiveTestFilePath>javatutorial/test/LifeCycleOfObjectTest_javatutorial_A_activity.xml</adaptiveTestFilePath></adaptiveTest></testFiles></question><question codeQuestion="3"><enunciate>How does a program destroy an object that it creates?</enunciate><image /><answers numberOfCorrect="1" numberOfAnswers="2"><answer codeAnswer="1"><textAnswer>A program does not explicitly destroy objects. A program can set all references to an object to null so that the becomes eligible for garbage collection</textAnswer><correct>true</correct><explanation>No Explanation</explanation></answer><answer codeAnswer="2"><textAnswer>Using the operator delete</textAnswer><correct>false</correct><explanation>Write here the explanation.</explanation></answer></answers><irtParameters><difficulty>0.0</difficulty><discrimination>1.0</discrimination><guessing>0.5</guessing></irtParameters><statisticParameters><exhibitionRate>0.0</exhibitionRate><answerTime>0</answerTime><successRate>0.0</successRate><numberOfUses>0</numberOfUses><numberOfSuccesses>0</numberOfSuccesses></statisticParameters><testFiles><adaptiveTest><adaptiveTestFilePath>javatutorial/test/LifeCycleOfObjectTest_javatutorial_A_activity.xml</adaptiveTestFilePath></adaptiveTest></testFiles></question></questions></fileOfQuestions>
