<?xml version="1.0" encoding="utf-8"?>
<!DOCTYPE fileOfQuestions SYSTEM "../../fileOfQuestions.dtd">
<fileOfQuestions fileName="UsingPackagesTest_javatutorial_items.xml" name="UsingPackagesTest_javatutorial_items" course="javatutorial" path="javatutorial/itemsFiles/UsingPackagesTest_javatutorial_items.xml" numberOfAnswersForFile="2"><concept value="javatutorial.UsingPackagesTest" /><questions><question codeQuestion="1"><enunciate>Assume that you have written some classes. Belatedly, you decide that they should be split into three packages, as listed in the table below. Furthermore, assume that the classes are currently in the default package (they have no package statements). What line of code will you need to add to each source file to put each class in the right package?</enunciate><image>javatutorial/itemsFiles/images/UsingPackagesTest_javatutorial_items/UsingPackagesTest_javatutorial_items_1.gif</image><answers numberOfCorrect="1" numberOfAnswers="3"><answer codeAnswer="1"><textAnswer>In Client.java add: package mygame.client; In Server.java add: package mygame.server;: In Utilities.java add: package mygame.shared;</textAnswer><correct>true</correct><explanation>Write here the explanation.</explanation></answer><answer codeAnswer="2"><textAnswer>In Client.java add: package mygame.client; In Server.java add: package mygame.server;: In Utilities.java add: package mygame.server;</textAnswer><correct>false</correct><explanation>Write here the explanation.</explanation></answer><answer codeAnswer="3"><textAnswer>In Client.java add: package mygame.client; In Server.java add: package mygame.server;: In Utilities.java add: package mygame.client;</textAnswer><correct>false</correct><explanation>Write here the explanation.</explanation></answer></answers><irtParameters><difficulty>0.0</difficulty><discrimination>1.0</discrimination><guessing>0.3333333333333333</guessing></irtParameters><statisticParameters><exhibitionRate>0.0</exhibitionRate><answerTime>0</answerTime><successRate>0.0</successRate><numberOfUses>0</numberOfUses><numberOfSuccesses>0</numberOfSuccesses></statisticParameters><testFiles><adaptiveTest><adaptiveTestFilePath>javatutorial/test/UsingPackagesTest_javatutorial_A_activity.xml</adaptiveTestFilePath></adaptiveTest></testFiles></question></questions></fileOfQuestions>
