<?xml version="1.0" encoding="utf-8"?>
<!DOCTYPE fileOfQuestions SYSTEM "../../fileOfQuestions.dtd">
<fileOfQuestions fileName="ObjectOrientedProgrammingConceptsTest_javatutorial_items.xml" name="ObjectOrientedProgrammingConceptsTest_javatutorial_items" course="javatutorial" path="javatutorial/itemsFiles/ObjectOrientedProgrammingConceptsTest_javatutorial_items.xml" numberOfAnswersForFile="2"><concept value="javatutorial.ObjectOrientedProgrammingConceptsTest" /><questions><question codeQuestion="1"><enunciate>We uses Color.BLACK to refer the black color. What other colors can you get by name like this?</enunciate><image /><answers numberOfCorrect="1" numberOfAnswers="2"><answer codeAnswer="1"><textAnswer>Color.black, Color.blue, Color.cyan, Color.darkGray, Color.gray, Color.green, Color.lightGray, Color.magenta, Color.orange, Color.pink, Color.white, and Color.yellow</textAnswer><correct>true</correct><explanation>No explanation</explanation></answer><answer codeAnswer="2"><textAnswer>Just only Color.BLACK and Color.WHITE</textAnswer><correct>false</correct><explanation>No explanation.</explanation></answer></answers><irtParameters><difficulty>0.0</difficulty><discrimination>1.0</discrimination><guessing>0.5</guessing></irtParameters><statisticParameters><exhibitionRate>0.0</exhibitionRate><answerTime>0</answerTime><successRate>0.0</successRate><numberOfUses>0</numberOfUses><numberOfSuccesses>0</numberOfSuccesses></statisticParameters><testFiles><adaptiveTest><adaptiveTestFilePath>javatutorial/test/ObjectOrientedProgrammingConceptsTest_javatutorial_A_activity.xml</adaptiveTestFilePath></adaptiveTest></testFiles></question><question codeQuestion="2"><enunciate>How would you create a Color object to represent purple? (Hint: Purple is made up of equal parts red and blue.)</enunciate><image /><answers numberOfCorrect="1" numberOfAnswers="2"><answer codeAnswer="1"><textAnswer>There is no pre-defined purple color in class Color</textAnswer><correct>false</correct><explanation>No explanation.</explanation></answer><answer codeAnswer="2"><textAnswer>You specify them using the RGB (red-green-blue) color model. In RGB, purple is: 0.5, 0.0, 0.5</textAnswer><correct>true</correct><explanation>No explanation.</explanation></answer></answers><irtParameters><difficulty>0.0</difficulty><discrimination>1.0</discrimination><guessing>0.5</guessing></irtParameters><statisticParameters><exhibitionRate>0.0</exhibitionRate><answerTime>0</answerTime><successRate>0.0</successRate><numberOfUses>0</numberOfUses><numberOfSuccesses>0</numberOfSuccesses></statisticParameters><testFiles><adaptiveTest><adaptiveTestFilePath>javatutorial/test/ObjectOrientedProgrammingConceptsTest_javatutorial_A_activity.xml</adaptiveTestFilePath></adaptiveTest></testFiles></question><question codeQuestion="3"><enunciate>What Graphics method would you use to draw a filled square?</enunciate><image /><answers numberOfCorrect="1" numberOfAnswers="4"><answer codeAnswer="1"><textAnswer>fillRect</textAnswer><correct>true</correct><explanation>No explanation.</explanation></answer><answer codeAnswer="2"><textAnswer>drawRect</textAnswer><correct>false</correct><explanation>No explanation.</explanation></answer><answer codeAnswer="3"><textAnswer>drawPolygon</textAnswer><correct>false</correct><explanation>No explanation.</explanation></answer><answer codeAnswer="4"><textAnswer>draw3DRect</textAnswer><correct>false</correct><explanation>No explanation.</explanation></answer></answers><irtParameters><difficulty>0.0</difficulty><discrimination>1.0</discrimination><guessing>0.25</guessing></irtParameters><statisticParameters><exhibitionRate>0.0</exhibitionRate><answerTime>0</answerTime><successRate>0.0</successRate><numberOfUses>0</numberOfUses><numberOfSuccesses>0</numberOfSuccesses></statisticParameters><testFiles><adaptiveTest><adaptiveTestFilePath>javatutorial/test/ObjectOrientedProgrammingConceptsTest_javatutorial_A_activity.xml</adaptiveTestFilePath></adaptiveTest></testFiles></question><question codeQuestion="4"><enunciate>What Graphics method (s) would you use to draw text?</enunciate><image /><answers numberOfCorrect="1" numberOfAnswers="4"><answer codeAnswer="1"><textAnswer>drawImage and drawOval</textAnswer><correct>false</correct><explanation>No explanation.</explanation></answer><answer codeAnswer="2"><textAnswer>drawBytes and drawChars</textAnswer><correct>true</correct><explanation>No explanation.</explanation></answer><answer codeAnswer="3"><textAnswer>drawString and drawText</textAnswer><correct>false</correct><explanation>No explanation.</explanation></answer><answer codeAnswer="4"><textAnswer>print and println</textAnswer><correct>false</correct><explanation>No explanation.</explanation></answer></answers><irtParameters><difficulty>0.0</difficulty><discrimination>1.0</discrimination><guessing>0.25</guessing></irtParameters><statisticParameters><exhibitionRate>0.0</exhibitionRate><answerTime>0</answerTime><successRate>0.0</successRate><numberOfUses>0</numberOfUses><numberOfSuccesses>0</numberOfSuccesses></statisticParameters><testFiles><adaptiveTest><adaptiveTestFilePath>javatutorial/test/ObjectOrientedProgrammingConceptsTest_javatutorial_A_activity.xml</adaptiveTestFilePath></adaptiveTest></testFiles></question></questions></fileOfQuestions>
