<?xml version="1.0" encoding="utf-8"?>
<!DOCTYPE fileOfQuestions SYSTEM "../../fileOfQuestions.dtd">
<fileOfQuestions fileName="ControlFlowStatementsTest_javatutorial_items.xml" name="ControlFlowStatementsTest_javatutorial_items" course="javatutorial" path="javatutorial/itemsFiles/ControlFlowStatementsTest_javatutorial_items.xml" numberOfAnswersForFile="2"><concept value="javatutorial.ControlFlowStatementsTest" /><questions><question codeQuestion="1"><enunciate>What's wrong with the following code snippet: "if (i = 1) { /* do something */ }"</enunciate><image /><answers numberOfCorrect="1" numberOfAnswers="2"><answer codeAnswer="1"><textAnswer>It should use == instead of =</textAnswer><correct>true</correct><explanation>Write here the explanation.</explanation></answer><answer codeAnswer="2"><textAnswer>Wrong position for {</textAnswer><correct>false</correct><explanation>Write here the explanation.</explanation></answer></answers><irtParameters><difficulty>0.0</difficulty><discrimination>1.0</discrimination><guessing>0.5</guessing></irtParameters><statisticParameters><exhibitionRate>0.0</exhibitionRate><answerTime>0</answerTime><successRate>0.0</successRate><numberOfUses>-1</numberOfUses><numberOfSuccesses>-1</numberOfSuccesses></statisticParameters><testFiles><adaptiveTest><adaptiveTestFilePath>javatutorial/test/ControlFlowStatementsTest_javatutorial_A_activity.xml</adaptiveTestFilePath></adaptiveTest></testFiles></question><question codeQuestion="2"><enunciate>Consider the following code snippet. What output do you think the code will produce if aNumber is 3?</enunciate><image>javatutorial/itemsFiles/images/ControlFlowStatementsTest_javatutorial_items/ControlFlowStatementsTest_javatutorial_items_2.gif</image><answers numberOfCorrect="1" numberOfAnswers="3"><answer codeAnswer="1"><textAnswer>second string third string</textAnswer><correct>true</correct><explanation>Write here the explanation.</explanation></answer><answer codeAnswer="2"><textAnswer>first string third string</textAnswer><correct>false</correct><explanation>Write here the explanation.</explanation></answer><answer codeAnswer="3"><textAnswer>second string first string</textAnswer><correct>false</correct><explanation>Write here the explanation.</explanation></answer></answers><irtParameters><difficulty>0.0</difficulty><discrimination>1.0</discrimination><guessing>0.3333333333333333</guessing></irtParameters><statisticParameters><exhibitionRate>0.0</exhibitionRate><answerTime>0</answerTime><successRate>0.0</successRate><numberOfUses>-1</numberOfUses><numberOfSuccesses>-1</numberOfSuccesses></statisticParameters><testFiles><adaptiveTest><adaptiveTestFilePath>javatutorial/test/ControlFlowStatementsTest_javatutorial_A_activity.xml</adaptiveTestFilePath></adaptiveTest></testFiles></question></questions></fileOfQuestions>
