<?xml version="1.0" encoding="utf-8"?>
<!DOCTYPE fileOfQuestions SYSTEM "../../fileOfQuestions.dtd">
<fileOfQuestions fileName="OperatorsTest_javatutorial_items.xml" name="OperatorsTest_javatutorial_items" course="javatutorial" path="javatutorial/itemsFiles/OperatorsTest_javatutorial_items.xml" numberOfAnswersForFile="2"><concept value="javatutorial.OperatorsTest" /><questions><question codeQuestion="1"><enunciate>Consider the following code snippet: "arrayOfInts[j] &gt; arrayOfInts[j+1]". What operators does the code contain?</enunciate><image /><answers numberOfCorrect="1" numberOfAnswers="4"><answer codeAnswer="1"><textAnswer>[], &gt;, +</textAnswer><correct>true</correct><explanation>Write here the explanation.</explanation></answer><answer codeAnswer="2"><textAnswer>[], &gt;, j</textAnswer><correct>false</correct><explanation>Write here the explanation.</explanation></answer><answer codeAnswer="3"><textAnswer>&gt;,+</textAnswer><correct>false</correct><explanation>Write here the explanation.</explanation></answer><answer codeAnswer="4"><textAnswer>+, []</textAnswer><correct>false</correct><explanation>Write here the explanation.</explanation></answer></answers><irtParameters><difficulty>0.0</difficulty><discrimination>1.0</discrimination><guessing>0.25</guessing></irtParameters><statisticParameters><exhibitionRate>0.0</exhibitionRate><answerTime>0</answerTime><successRate>0.0</successRate><numberOfUses>-1</numberOfUses><numberOfSuccesses>-1</numberOfSuccesses></statisticParameters><testFiles><adaptiveTest><adaptiveTestFilePath>javatutorial/test/OperatorsTest_javatutorial_A_activity.xml</adaptiveTestFilePath></adaptiveTest></testFiles></question><question codeQuestion="2"><enunciate>Consider the following code snippet: "int i = 10; int n = i++%5;". What are the values of i and n after the code is executed?</enunciate><image /><answers numberOfCorrect="1" numberOfAnswers="5"><answer codeAnswer="1"><textAnswer>i is 10, and n is 0</textAnswer><correct>false</correct><explanation>Write here the explanation.</explanation></answer><answer codeAnswer="2"><textAnswer>i is 11, and n is 1</textAnswer><correct>false</correct><explanation>Write here the explanation.</explanation></answer><answer codeAnswer="3"><textAnswer>i is 11, and n is 0</textAnswer><correct>true</correct><explanation>Write here the explanation.</explanation></answer><answer codeAnswer="4"><textAnswer>i is 10, and n is 1</textAnswer><correct>false</correct><explanation>Write here the explanation.</explanation></answer><answer codeAnswer="5"><textAnswer>i is 9, and n is 1</textAnswer><correct>false</correct><explanation>Write here the explanation.</explanation></answer></answers><irtParameters><difficulty>0.0</difficulty><discrimination>1.0</discrimination><guessing>0.2</guessing></irtParameters><statisticParameters><exhibitionRate>0.0</exhibitionRate><answerTime>0</answerTime><successRate>0.0</successRate><numberOfUses>-1</numberOfUses><numberOfSuccesses>-1</numberOfSuccesses></statisticParameters><testFiles><adaptiveTest><adaptiveTestFilePath>javatutorial/test/OperatorsTest_javatutorial_A_activity.xml</adaptiveTestFilePath></adaptiveTest></testFiles></question><question codeQuestion="3"><enunciate>Consider the following code snippet: "int i = 10; int n = i++%5;". What are the final values of i and n if instead of using the postfix increment operator (i++), you use the prefix version (++i))?</enunciate><image /><answers numberOfCorrect="1" numberOfAnswers="4"><answer codeAnswer="1"><textAnswer>i is 11, and n is 1</textAnswer><correct>true</correct><explanation>Write here the explanation.</explanation></answer><answer codeAnswer="2"><textAnswer>i is 11, and n is 0</textAnswer><correct>false</correct><explanation>Write here the explanation.</explanation></answer><answer codeAnswer="3"><textAnswer>i is 10, and n is 1</textAnswer><correct>false</correct><explanation>Write here the explanation.</explanation></answer><answer codeAnswer="4"><textAnswer>i is 12, and n is 0</textAnswer><correct>false</correct><explanation>Write here the explanation.</explanation></answer></answers><irtParameters><difficulty>0.0</difficulty><discrimination>1.0</discrimination><guessing>0.25</guessing></irtParameters><statisticParameters><exhibitionRate>0.0</exhibitionRate><answerTime>0</answerTime><successRate>0.0</successRate><numberOfUses>-1</numberOfUses><numberOfSuccesses>-1</numberOfSuccesses></statisticParameters><testFiles><adaptiveTest><adaptiveTestFilePath>javatutorial/test/OperatorsTest_javatutorial_A_activity.xml</adaptiveTestFilePath></adaptiveTest></testFiles></question><question codeQuestion="4"><enunciate>What is the value of i after the following code snippet executes: "int i = 8; i &gt;&gt;=2;"</enunciate><image /><answers numberOfCorrect="1" numberOfAnswers="4"><answer codeAnswer="1"><textAnswer>i is 4.</textAnswer><correct>false</correct><explanation>Write here the explanation.</explanation></answer><answer codeAnswer="2"><textAnswer>i is 2.</textAnswer><correct>true</correct><explanation>Write here the explanation.</explanation></answer><answer codeAnswer="3"><textAnswer>i is 0.</textAnswer><correct>false</correct><explanation>Write here the explanation.</explanation></answer><answer codeAnswer="4"><textAnswer>i is 1.</textAnswer><correct>false</correct><explanation>Write here the explanation.</explanation></answer></answers><irtParameters><difficulty>0.0</difficulty><discrimination>1.0</discrimination><guessing>0.25</guessing></irtParameters><statisticParameters><exhibitionRate>0.0</exhibitionRate><answerTime>0</answerTime><successRate>0.0</successRate><numberOfUses>-1</numberOfUses><numberOfSuccesses>-1</numberOfSuccesses></statisticParameters><testFiles><adaptiveTest><adaptiveTestFilePath>javatutorial/test/OperatorsTest_javatutorial_A_activity.xml</adaptiveTestFilePath></adaptiveTest></testFiles></question><question codeQuestion="5"><enunciate>What is the value of i after the following code snippet executes: "int i = 17; i &gt;&gt;=1;"</enunciate><image /><answers numberOfCorrect="1" numberOfAnswers="4"><answer codeAnswer="1"><textAnswer>i is 8.</textAnswer><correct>true</correct><explanation>Write here the explanation.</explanation></answer><answer codeAnswer="2"><textAnswer>i is 16.</textAnswer><correct>false</correct><explanation>Write here the explanation.</explanation></answer><answer codeAnswer="3"><textAnswer>i is 7.</textAnswer><correct>false</correct><explanation>Write here the explanation.</explanation></answer><answer codeAnswer="4"><textAnswer>i is 34.</textAnswer><correct>false</correct><explanation>Write here the explanation.</explanation></answer></answers><irtParameters><difficulty>0.0</difficulty><discrimination>1.0</discrimination><guessing>0.25</guessing></irtParameters><statisticParameters><exhibitionRate>0.0</exhibitionRate><answerTime>0</answerTime><successRate>0.0</successRate><numberOfUses>-1</numberOfUses><numberOfSuccesses>-1</numberOfSuccesses></statisticParameters><testFiles><adaptiveTest><adaptiveTestFilePath>javatutorial/test/OperatorsTest_javatutorial_A_activity.xml</adaptiveTestFilePath></adaptiveTest></testFiles></question></questions></fileOfQuestions>
