<?xml version="1.0" encoding="utf-8"?>
<!DOCTYPE fileOfQuestions SYSTEM "../../fileOfQuestions.dtd">
<fileOfQuestions fileName="VariablesTest_javatutorial_items.xml" name="VariablesTest_javatutorial_items" course="javatutorial" path="javatutorial/itemsFiles/VariablesTest_javatutorial_items.xml" numberOfAnswersForFile="2"><concept value="javatutorial.VariablesTest" /><questions><question codeQuestion="1"><enunciate>Write here the text question.Which of the following are valid variable names?</enunciate><image /><answers numberOfCorrect="6" numberOfAnswers="10"><answer codeAnswer="1"><textAnswer>int</textAnswer><correct>false</correct><explanation>"int" is the keyword</explanation></answer><answer codeAnswer="2"><textAnswer>anInt</textAnswer><correct>true</correct><explanation>No explanation.</explanation></answer><answer codeAnswer="3"><textAnswer>i</textAnswer><correct>true</correct><explanation>No explanation.</explanation></answer><answer codeAnswer="4"><textAnswer>i1</textAnswer><correct>true</correct><explanation>No explanation.</explanation></answer><answer codeAnswer="5"><textAnswer>1</textAnswer><correct>false</correct><explanation>This is a number letter</explanation></answer><answer codeAnswer="6"><textAnswer>thing1</textAnswer><correct>true</correct><explanation>No explanation.</explanation></answer><answer codeAnswer="7"><textAnswer>1thing</textAnswer><correct>false</correct><explanation>The first letter can't be a number letter</explanation></answer><answer codeAnswer="8"><textAnswer>ONE-HUNDRED</textAnswer><correct>false</correct><explanation>The minus letter "-" is the special world not allowed in variable name</explanation></answer><answer codeAnswer="9"><textAnswer>ONE_HUNDRED</textAnswer><correct>true</correct><explanation>No explanation.</explanation></answer><answer codeAnswer="10"><textAnswer>something2do</textAnswer><correct>true</correct><explanation>No explanation.</explanation></answer></answers><irtParameters><difficulty>0.0</difficulty><discrimination>1.0</discrimination><guessing>0.1</guessing></irtParameters><statisticParameters><exhibitionRate>0.0</exhibitionRate><answerTime>0</answerTime><successRate>0.0</successRate><numberOfUses>-1</numberOfUses><numberOfSuccesses>-1</numberOfSuccesses></statisticParameters><testFiles><adaptiveTest><adaptiveTestFilePath>javatutorial/test/VariablesTest_javatutorial_A_activity.xml</adaptiveTestFilePath></adaptiveTest></testFiles></question><question codeQuestion="2"><enunciate>Given the source code of program (see the following), what is the name of each variable declared in the program? (Remember that method parameters are also variables) And What is the scope of each variable?</enunciate><image>javatutorial/itemsFiles/images/VariablesTest_javatutorial_items/VariablesTest_javatutorial_items_2.gif</image><answers numberOfCorrect="1" numberOfAnswers="3"><answer codeAnswer="1"><textAnswer>Names of Variables are: args, sum, current.The variable "args" has scope within the entire main method. The variable "sum" is a local variable that is valid from its declaration to the end of the main method. The variable "current" is available from its declaration to the } that closes the for loop</textAnswer><correct>true</correct><explanation>No explanation.</explanation></answer><answer codeAnswer="2"><textAnswer>Names of Variables are: args, Sum, current. The variable "args" has scope within the entire main method. The variable "Sum" is a global variable. The variable "current" is available from its declaration to the } that closes the for loop</textAnswer><correct>false</correct><explanation>No explanation.</explanation></answer><answer codeAnswer="3"><textAnswer>Names of Variables are: args, current, sum. The variable "args" is a global variable. The variable "current" is available from its declaration to the } that closes the for loop. The variable "sum" has scope within the entire main method.</textAnswer><correct>false</correct><explanation>No explanation.</explanation></answer></answers><irtParameters><difficulty>0.0</difficulty><discrimination>1.0</discrimination><guessing>0.3333333333333333</guessing></irtParameters><statisticParameters><exhibitionRate>0.0</exhibitionRate><answerTime>0</answerTime><successRate>0.0</successRate><numberOfUses>-1</numberOfUses><numberOfSuccesses>-1</numberOfSuccesses></statisticParameters><testFiles><adaptiveTest><adaptiveTestFilePath>javatutorial/test/VariablesTest_javatutorial_A_activity.xml</adaptiveTestFilePath></adaptiveTest></testFiles></question></questions></fileOfQuestions>
