<?xml version="1.0" encoding="utf-8"?>
<!DOCTYPE fileOfQuestions SYSTEM "../../fileOfQuestions.dtd">
<fileOfQuestions fileName="NestedClassesTest_javatutorial_items.xml" name="NestedClassesTest_javatutorial_items" course="javatutorial" path="javatutorial/itemsFiles/NestedClassesTest_javatutorial_items.xml" numberOfAnswersForFile="2"><concept value="javatutorial.NestedClassesTest" /><questions><question codeQuestion="1"><enunciate>Match each situation in the first column with the most appropriate type of nested class in the second column.</enunciate><image>javatutorial/itemsFiles/images/NestedClassesTest_javatutorial_items/NestedClassesTest_javatutorial_items_1.gif</image><answers numberOfCorrect="6" numberOfAnswers="10"><answer codeAnswer="1"><textAnswer>a. 2. (protected inner class)</textAnswer><correct>true</correct><explanation>Write here the explanation.</explanation></answer><answer codeAnswer="2"><textAnswer>b. 3. (public static nested class)</textAnswer><correct>true</correct><explanation>Write here the explanation.</explanation></answer><answer codeAnswer="3"><textAnswer>c. 6. (private inner class)</textAnswer><correct>true</correct><explanation>Write here the explanation.</explanation></answer><answer codeAnswer="4"><textAnswer>d. 1. (anonymous inner class)</textAnswer><correct>true</correct><explanation>Write here the explanation.</explanation></answer><answer codeAnswer="5"><textAnswer>e. 4. (protected static nested class)</textAnswer><correct>true</correct><explanation>Write here the explanation.</explanation></answer><answer codeAnswer="6"><textAnswer>f. 5. (private static nested class)</textAnswer><correct>true</correct><explanation>Write here the explanation.</explanation></answer><answer codeAnswer="7"><textAnswer>c. 3. (private inner class)</textAnswer><correct>false</correct><explanation>Write here the explanation.</explanation></answer><answer codeAnswer="8"><textAnswer>d. 2. (anonymous inner class)</textAnswer><correct>false</correct><explanation>Write here the explanation.</explanation></answer><answer codeAnswer="9"><textAnswer>f. 1. (private static nested class)</textAnswer><correct>false</correct><explanation>Write here the explanation.</explanation></answer><answer codeAnswer="10"><textAnswer>b. 6. (public static nested class)</textAnswer><correct>false</correct><explanation>Write here the explanation.</explanation></answer></answers><irtParameters><difficulty>0.0</difficulty><discrimination>1.0</discrimination><guessing>0.1</guessing></irtParameters><statisticParameters><exhibitionRate>0.0</exhibitionRate><answerTime>0</answerTime><successRate>0.0</successRate><numberOfUses>0</numberOfUses><numberOfSuccesses>0</numberOfSuccesses></statisticParameters><testFiles><adaptiveTest><adaptiveTestFilePath>javatutorial/test/NestedClassesTest_javatutorial_A_activity.xml</adaptiveTestFilePath></adaptiveTest></testFiles></question></questions></fileOfQuestions>
